{
  "$schema": "https://json-schema.org/draft/2020-12/schema",
  "title": "Run Analytics Schema",
  "type": "object",
  "required": [
    "run_id",
    "seed",
    "route",
    "ended",
    "victory",
    "end_reason",
    "player_final",
    "decision_log",
    "summary",
    "failure_analysis"
  ],
  "properties": {
    "run_id": { "type": "string", "minLength": 1 },
    "seed": { "type": "integer" },
    "route": {
      "type": "array",
      "items": { "type": "string", "minLength": 1 },
      "minItems": 1
    },
    "ended": { "type": "boolean" },
    "victory": { "type": "boolean" },
    "end_reason": { "type": ["string", "null"] },
    "player_final": {
      "type": "object",
      "required": ["hp", "food", "ammo", "medkits", "scrap", "radiation"],
      "properties": {
        "hp": { "type": "integer" },
        "food": { "type": "integer" },
        "ammo": { "type": "integer" },
        "medkits": { "type": "integer" },
        "scrap": { "type": "integer" },
        "radiation": { "type": "integer" }
      },
      "additionalProperties": false
    },
    "decision_log": {
      "type": "array",
      "items": {
        "type": "object",
        "required": ["step", "node", "event_id", "option_index", "warning_signals", "pre_choice_state", "pressure", "player_after"],
        "properties": {
          "step": { "type": "integer", "minimum": 1 },
          "node": { "type": "string" },
          "event_id": { "type": "string" },
          "option_index": { "type": "integer", "minimum": 0 },
          "warning_signals": {
            "type": "array",
            "items": { "type": "string" }
          },
          "pre_choice_state": {
            "type": "object",
            "required": ["hp", "food", "ammo", "medkits", "radiation"],
            "properties": {
              "hp": { "type": "integer" },
              "food": { "type": "integer" },
              "ammo": { "type": "integer" },
              "medkits": { "type": "integer" },
              "radiation": { "type": "integer" }
            },
            "additionalProperties": false
          },
          "pressure": { "type": "boolean" },
          "combat_triggered": { "type": "boolean" },
          "effects": { "type": "object" },
          "player_after": {
            "type": "object",
            "required": ["hp", "food", "ammo", "medkits", "radiation"],
            "properties": {
              "hp": { "type": "integer" },
              "food": { "type": "integer" },
              "ammo": { "type": "integer" },
              "medkits": { "type": "integer" },
              "radiation": { "type": "integer" }
            },
            "additionalProperties": false
          }
        },
        "additionalProperties": false
      }
    },
    "summary": {
      "type": "object",
      "required": ["pressure_count", "death_cause_attribution", "resource_signature"],
      "properties": {
        "pressure_count": { "type": "integer", "minimum": 0 },
        "death_cause_attribution": { "type": "boolean" },
        "resource_signature": { "type": "string", "minLength": 1 }
      },
      "additionalProperties": false
    },
    "failure_analysis": {
      "type": "object",
      "required": ["death_chain_length", "primary_blame_factor", "regret_nodes", "steps_from_regret_to_death", "is_trash_time_death"],
      "properties": {
        "death_chain_length": { "type": "integer", "minimum": 0 },
        "primary_blame_factor": { "type": ["string", "null"] },
        "regret_nodes": {
          "type": "array",
          "items": {
            "type": "object",
            "required": ["node_id", "event_id", "blame_score", "description"],
            "properties": {
              "node_id": { "type": "string", "minLength": 1 },
              "event_id": { "type": "string", "minLength": 1 },
              "blame_score": { "type": "number", "minimum": 0, "maximum": 1 },
              "description": { "type": "string", "minLength": 1 },
              "steps_to_death": { "type": "integer", "minimum": 0 }
            },
            "additionalProperties": false
          }
        },
        "steps_from_regret_to_death": { "type": "integer", "minimum": 0 },
        "is_trash_time_death": { "type": "boolean" }
      },
      "additionalProperties": false
    }
  },
  "additionalProperties": false
}
