{
  "run_id": "north_cautious_batch_7",
  "seed": 702,
  "route": [
    "node_north_1",
    "node_north_2",
    "node_mid",
    "node_final"
  ],
  "ended": true,
  "victory": false,
  "end_reason": "starvation",
  "player_final": {
    "hp": 10,
    "food": 0,
    "ammo": 3,
    "medkits": 2,
    "scrap": 0,
    "radiation": 0
  },
  "decision_log": [
    {
      "step": 1,
      "node": "node_north_1",
      "event_id": "evt_scrapyard",
      "option_index": 1,
      "warning_signals": [],
      "pre_choice_state": {
        "hp": 10,
        "food": 6,
        "ammo": 3,
        "medkits": 1,
        "radiation": 0
      },
      "pressure": true,
      "combat_triggered": false,
      "effects": {
        "food": -1
      },
      "player_after": {
        "hp": 10,
        "food": 5,
        "ammo": 3,
        "medkits": 1,
        "radiation": 0
      }
    },
    {
      "step": 2,
      "node": "node_north_2",
      "event_id": "evt_tunnel",
      "option_index": 1,
      "warning_signals": [],
      "pre_choice_state": {
        "hp": 10,
        "food": 4,
        "ammo": 3,
        "medkits": 1,
        "radiation": 0
      },
      "pressure": true,
      "combat_triggered": false,
      "effects": {
        "food": -1,
        "medkits": 1
      },
      "player_after": {
        "hp": 10,
        "food": 3,
        "ammo": 3,
        "medkits": 2,
        "radiation": 0
      }
    },
    {
      "step": 3,
      "node": "node_mid",
      "event_id": "evt_checkpoint",
      "option_index": 1,
      "warning_signals": [
        "WARNING: food is low and route slack is nearly gone."
      ],
      "pre_choice_state": {
        "hp": 10,
        "food": 2,
        "ammo": 3,
        "medkits": 2,
        "radiation": 0
      },
      "pressure": true,
      "combat_triggered": false,
      "effects": {
        "food": -1
      },
      "player_after": {
        "hp": 10,
        "food": 1,
        "ammo": 3,
        "medkits": 2,
        "radiation": 0
      }
    },
    {
      "step": 4,
      "node": "node_final",
      "event_id": "evt_final",
      "option_index": 0,
      "warning_signals": [
        "WARNING: food is low and route slack is nearly gone."
      ],
      "pre_choice_state": {
        "hp": 10,
        "food": 0,
        "ammo": 3,
        "medkits": 2,
        "radiation": 0
      },
      "pressure": true,
      "combat_triggered": false,
      "effects": {
        "food": -1
      },
      "player_after": {
        "hp": 10,
        "food": 0,
        "ammo": 3,
        "medkits": 2,
        "radiation": 0
      }
    }
  ],
  "summary": {
    "pressure_count": 4,
    "death_cause_attribution": true,
    "resource_signature": "hp:10|food:0|ammo:3|medkits:2|scrap:0|radiation:0"
  },
  "failure_analysis": {
    "death_chain_length": 3,
    "primary_blame_factor": "resource_exhaustion",
    "regret_nodes": [
      {
        "node_id": "node_final",
        "event_id": "evt_final",
        "blame_score": 0.27,
        "description": "lost 1 food",
        "steps_to_death": 0
      },
      {
        "node_id": "node_mid",
        "event_id": "evt_checkpoint",
        "blame_score": 0.26,
        "description": "lost 1 food",
        "steps_to_death": 1
      },
      {
        "node_id": "node_north_2",
        "event_id": "evt_tunnel",
        "blame_score": 0.24,
        "description": "lost 1 food",
        "steps_to_death": 2
      }
    ],
    "steps_from_regret_to_death": 0,
    "is_trash_time_death": false
  }
}