{
  "run_id": "south_cautious_batch_4",
  "seed": 404,
  "route": [
    "node_south_1",
    "node_south_2",
    "node_mid",
    "node_final"
  ],
  "ended": true,
  "victory": true,
  "end_reason": "reached_final_node",
  "player_final": {
    "hp": 10,
    "food": 2,
    "ammo": 1,
    "medkits": 2,
    "scrap": 0,
    "radiation": 0
  },
  "decision_log": [
    {
      "step": 1,
      "node": "node_south_1",
      "event_id": "evt_village",
      "option_index": 0,
      "warning_signals": [],
      "pre_choice_state": {
        "hp": 10,
        "food": 6,
        "ammo": 3,
        "medkits": 1,
        "radiation": 0
      },
      "pressure": true,
      "combat_triggered": false,
      "effects": {
        "ammo": -1,
        "medkits": 1
      },
      "player_after": {
        "hp": 10,
        "food": 6,
        "ammo": 2,
        "medkits": 2,
        "radiation": 0
      }
    },
    {
      "step": 2,
      "node": "node_south_2",
      "event_id": "evt_floodplain",
      "option_index": 1,
      "warning_signals": [],
      "pre_choice_state": {
        "hp": 10,
        "food": 5,
        "ammo": 2,
        "medkits": 2,
        "radiation": 0
      },
      "pressure": true,
      "combat_triggered": false,
      "effects": {
        "food": 1,
        "ammo": -1
      },
      "player_after": {
        "hp": 10,
        "food": 6,
        "ammo": 1,
        "medkits": 2,
        "radiation": 0
      }
    },
    {
      "step": 3,
      "node": "node_mid",
      "event_id": "evt_checkpoint",
      "option_index": 1,
      "warning_signals": [],
      "pre_choice_state": {
        "hp": 10,
        "food": 5,
        "ammo": 1,
        "medkits": 2,
        "radiation": 0
      },
      "pressure": true,
      "combat_triggered": false,
      "effects": {
        "food": -1
      },
      "player_after": {
        "hp": 10,
        "food": 4,
        "ammo": 1,
        "medkits": 2,
        "radiation": 0
      }
    },
    {
      "step": 4,
      "node": "node_final",
      "event_id": "evt_final",
      "option_index": 0,
      "warning_signals": [],
      "pre_choice_state": {
        "hp": 10,
        "food": 3,
        "ammo": 1,
        "medkits": 2,
        "radiation": 0
      },
      "pressure": true,
      "combat_triggered": false,
      "effects": {
        "food": -1
      },
      "player_after": {
        "hp": 10,
        "food": 2,
        "ammo": 1,
        "medkits": 2,
        "radiation": 0
      }
    }
  ],
  "summary": {
    "pressure_count": 4,
    "death_cause_attribution": true,
    "resource_signature": "hp:10|food:2|ammo:1|medkits:2|scrap:0|radiation:0"
  },
  "failure_analysis": {
    "death_chain_length": 0,
    "primary_blame_factor": null,
    "regret_nodes": [],
    "steps_from_regret_to_death": 0,
    "is_trash_time_death": false
  }
}